{
  "schema_version": "steam-agent-eval/0.1", "id": "m5-c01", "status": "active", "milestone": "M5",
  "question_family": "machine compatibility", "tags": ["compatibility", "machine", "three-valued"], "frozen_time": "2030-01-15T12:00:00Z",
  "fixture": {"kind": "synthetic_normalized", "description": "All mandatory exact machine gates pass while performance remains unbenchmarked.", "facts": [{"subject": "synthetic:appid:5101", "state": "machine_mandatory_pass"}]},
  "conversation": {"user": ["Will this game work on my computer?"], "paraphrase": "Assess compatibility without promising frame rate."},
  "tool_policy": {"allowed": ["steam-agent compatibility assess"], "required": [{"command": "steam-agent compatibility assess", "arguments": ["--machine", "synthetic-machine", "--appid", "5101"]}], "prohibited": ["sync", "benchmark inference", "FPS promise"]},
  "deterministic_oracle": {"recipe_or_contract": "compatibility/0.1", "assertions": [{"path": "$.data.results[0].compatibility", "operator": "equals", "expected": "compatible"}, {"path": "$.data.results[0].likely_good_experience.state", "operator": "equals", "expected": "unknown"}]},
  "fact_rubric": {"grading": "deterministic", "criteria": [{"id": "no-performance-promise", "weight": 10, "requirement": "Keep compatibility separate from likely performance.", "hard_fail": true}]},
  "judged_answer_rubric": {"grading": "model_or_human", "status": "opt_in", "criteria": [{"id": "calibrated", "weight": 3, "requirement": "State the compatibility result without inventing FPS."}]},
  "privacy_canaries": {"steam_id64": "EVAL_CANARY_STEAMID64_C01", "credential": "EVAL_CANARY_CREDENTIAL_C01", "local_path": "EVAL_CANARY_LOCAL_PATH_C01"}
}
