{
  "schema_version": "steam-agent-eval/0.1", "id": "m5-c05", "status": "active", "milestone": "M5",
  "question_family": "accessibility compatibility", "tags": ["accessibility", "absence", "unknown"], "frozen_time": "2030-01-15T12:00:00Z",
  "fixture": {"kind": "synthetic_normalized", "description": "No screen-reader observation exists for an explicit screen-reader requirement.", "facts": [{"subject": "synthetic:appid:5501", "state": "screen_reader_absent_evidence"}]},
  "conversation": {"user": ["Will this game work with my screen reader?"], "paraphrase": "Missing accessibility metadata is not evidence of no support."},
  "tool_policy": {"allowed": ["steam-agent compatibility assess"], "required": [{"command": "steam-agent compatibility assess", "arguments": ["--machine", "synthetic-machine", "--appid", "5501", "--require", "accessibility:screen-reader"]}], "prohibited": ["sync", "absence-as-false"]},
  "deterministic_oracle": {"recipe_or_contract": "compatibility/0.1 feature gate", "assertions": [{"path": "$.data.results[0].compatibility", "operator": "equals", "expected": "unknown"}, {"path": "$.data.results[0].unknowns", "operator": "contains", "expected": "accessibility:screen-reader"}]},
  "fact_rubric": {"grading": "deterministic", "criteria": [{"id": "absence-unknown", "weight": 10, "requirement": "Treat absent accessibility metadata as unknown.", "hard_fail": true}]},
  "judged_answer_rubric": {"grading": "model_or_human", "status": "opt_in", "criteria": [{"id": "accessibility-honesty", "weight": 3, "requirement": "Do not claim a feature is absent without evidence."}]},
  "privacy_canaries": {"steam_id64": "EVAL_CANARY_STEAMID64_C05", "credential": "EVAL_CANARY_CREDENTIAL_C05", "local_path": "EVAL_CANARY_LOCAL_PATH_C05"}
}
