{
  "schema_version": "steam-agent-eval/0.1", "id": "m4-r09", "status": "active", "milestone": "M4",
  "question_family": "deterministic recommendation tie", "tags": ["determinism", "input-order", "tie-break"], "frozen_time": "2030-01-15T12:00:00Z",
  "fixture": {"kind": "synthetic_normalized", "description": "Two candidates have identical component scores and arrive in reverse identity order.", "facts": [{"subject": "synthetic:appid:1902", "state": "score_50"}, {"subject": "synthetic:appid:1901", "state": "score_50"}]},
  "conversation": {"user": ["Which tied game should appear first?"], "paraphrase": "Make the same recommendation regardless of input order."},
  "tool_policy": {"allowed": ["steam-agent recommendations query"], "required": [{"command": "steam-agent recommendations query", "arguments": ["--account", "synthetic-primary", "--recipe", "preference-fit/0.1"]}], "prohibited": ["sync", "random tie break", "provider-order tie break"]},
  "deterministic_oracle": {"recipe_or_contract": "preference-fit/0.1 stable tie break", "assertions": [
    {"path": "$.data.results[*].appid", "operator": "ordered_equals", "expected": [1901, 1902]}, {"path": "$.data.results[*].score", "operator": "ordered_equals", "expected": [50, 50]}, {"path": "$.data.recipe_version", "operator": "equals", "expected": "preference-fit/0.1"}
  ]},
  "fact_rubric": {"grading": "deterministic", "criteria": [{"id": "stable-tie", "weight": 10, "requirement": "Use the documented stable identity tie break.", "hard_fail": true}]},
  "judged_answer_rubric": {"grading": "model_or_human", "status": "opt_in", "criteria": [{"id": "tie-honesty", "weight": 2, "requirement": "Do not invent a qualitative distinction between equal scores."}]},
  "privacy_canaries": {"steam_id64": "EVAL_CANARY_STEAMID64_R09", "credential": "EVAL_CANARY_CREDENTIAL_R09", "local_path": "EVAL_CANARY_LOCAL_PATH_R09"}
}
