{
  "schema_version": "steam-agent-eval/0.1", "id": "m5-c06", "status": "active", "milestone": "M5",
  "question_family": "playable now", "tags": ["installed", "operations", "unknown"], "frozen_time": "2030-01-15T12:00:00Z",
  "fixture": {"kind": "synthetic_normalized", "description": "The title is owned, installed, and compatible but M7 operational facts are unavailable.", "facts": [{"subject": "synthetic:appid:5601", "state": "installed_owned_compatible"}]},
  "conversation": {"user": ["Can I play this right now?"], "paraphrase": "Do not collapse static compatibility into current readiness."},
  "tool_policy": {"allowed": ["steam-agent compatibility query"], "required": [{"command": "steam-agent compatibility query", "arguments": ["--machine", "synthetic-machine", "--appid", "5601"]}], "prohibited": ["sync", "launch", "operational inference"]},
  "deterministic_oracle": {"recipe_or_contract": "compatibility/0.1 playable-now boundary", "assertions": [{"path": "$.data.results[0].compatibility", "operator": "equals", "expected": "compatible"}, {"path": "$.data.results[0].playable_now", "operator": "equals", "expected": "unknown"}, {"path": "$.data.results[0].reasons", "operator": "contains", "expected": "playable_now_requires_m7_operational_facts"}]},
  "fact_rubric": {"grading": "deterministic", "criteria": [{"id": "static-vs-now", "weight": 10, "requirement": "Keep static compatibility separate from current readiness.", "hard_fail": true}]},
  "judged_answer_rubric": {"grading": "model_or_human", "status": "opt_in", "criteria": [{"id": "next-check", "weight": 3, "requirement": "Explain that current operational state still needs checking."}]},
  "privacy_canaries": {"steam_id64": "EVAL_CANARY_STEAMID64_C06", "credential": "EVAL_CANARY_CREDENTIAL_C06", "local_path": "EVAL_CANARY_LOCAL_PATH_C06"}
}
