{
  "schema_version": "steam-agent-eval/0.1", "id": "m4-r01", "status": "active", "milestone": "M4",
  "question_family": "resume next", "tags": ["activity", "resume", "recipe"], "frozen_time": "2030-01-15T12:00:00Z",
  "fixture": {"kind": "synthetic_normalized", "description": "A recently sustained unfinished game competes with an old game and an explicitly finished game.", "facts": [
    {"subject": "synthetic:appid:1101", "state": "recent_sustained_unfinished"}, {"subject": "synthetic:appid:1102", "state": "old_unfinished"}, {"subject": "synthetic:appid:1103", "state": "recent_finished"}
  ]},
  "conversation": {"user": ["What should I resume next?"], "paraphrase": "Pick a game I have momentum in and have not finished."},
  "tool_policy": {"allowed": ["steam-agent recommendations query"], "required": [{"command": "steam-agent recommendations query", "arguments": ["--account", "synthetic-primary", "--recipe", "resume/0.1"]}], "prohibited": ["sync", "feedback mutation", "browser"]},
  "deterministic_oracle": {"recipe_or_contract": "resume/0.1", "assertions": [
    {"path": "$.data.eligible[*].appid", "operator": "ordered_equals", "expected": [1101, 1102]},
    {"path": "$.data.excluded[0].appid", "operator": "equals", "expected": 1103},
    {"path": "$.data.eligible[0].positive_factors", "operator": "contains", "expected": "recent_sustained_play"}
  ]},
  "fact_rubric": {"grading": "deterministic", "criteria": [{"id": "resume-order", "weight": 5, "requirement": "Select the recent unfinished game and expose its factors.", "hard_fail": true}, {"id": "finished-gate", "weight": 5, "requirement": "Exclude the explicitly finished game before ranking.", "hard_fail": true}]},
  "judged_answer_rubric": {"grading": "model_or_human", "status": "opt_in", "criteria": [{"id": "momentum-explanation", "weight": 3, "requirement": "Explain momentum without inventing preference."}]},
  "privacy_canaries": {"steam_id64": "EVAL_CANARY_STEAMID64_R01", "credential": "EVAL_CANARY_CREDENTIAL_R01", "local_path": "EVAL_CANARY_LOCAL_PATH_R01"}
}
