{
  "schema_version": "steam-agent-eval/0.1", "id": "m5-c09", "status": "active", "milestone": "M5",
  "question_family": "Linux compatibility route", "tags": ["linux", "native-build", "proton", "unknown"], "frozen_time": "2030-01-15T12:00:00Z",
  "fixture": {"kind": "synthetic_normalized", "description": "The publisher declares no native Linux build and no reviewed Proton execution evidence exists.", "facts": [{"subject": "synthetic:appid:5901", "state": "no_native_linux_proton_unknown"}]},
  "conversation": {"user": ["Will this Windows game work on my Linux computer?"], "paraphrase": "Do not turn no native build into a Proton incompatibility claim."},
  "tool_policy": {"allowed": ["steam-agent compatibility assess"], "required": [{"command": "steam-agent compatibility assess", "arguments": ["--machine", "synthetic-machine", "--appid", "5901"]}], "prohibited": ["sync", "Proton inference", "native-build widening"]},
  "deterministic_oracle": {"recipe_or_contract": "compatibility/0.1 execution-route boundary", "assertions": [{"path": "$.data.results[0].compatibility", "operator": "equals", "expected": "unknown"}, {"path": "$.data.results[0].gates[0].original", "operator": "equals", "expected": "fail"}, {"path": "$.data.results[0].gates[1].effective", "operator": "equals", "expected": "unknown"}]},
  "fact_rubric": {"grading": "deterministic", "criteria": [{"id": "native-vs-effective", "weight": 10, "requirement": "Keep declared native build separate from effective execution support.", "hard_fail": true}]},
  "judged_answer_rubric": {"grading": "model_or_human", "status": "opt_in", "criteria": [{"id": "proton-gap", "weight": 3, "requirement": "Explain that the Proton route remains unevaluated."}]},
  "privacy_canaries": {"steam_id64": "EVAL_CANARY_STEAMID64_C09", "credential": "EVAL_CANARY_CREDENTIAL_C09", "local_path": "EVAL_CANARY_LOCAL_PATH_C09"}
}
