{
  "schema_version": "steam-agent-eval/0.1", "id": "m3-d07", "status": "active", "milestone": "M3",
  "question_family": "deal data quality", "tags": ["failure", "running", "unevaluated"], "frozen_time": "2030-01-15T12:00:00Z",
  "fixture": {"kind": "synthetic_normalized", "description": "Wishlist candidates have running, failed, and untargeted provider states.", "facts": [
    {"subject": "synthetic:appid:701", "state": "running"}, {"subject": "synthetic:appid:702", "state": "failed_rate_limited"}, {"subject": "synthetic:appid:703", "state": "unevaluated"}
  ]},
  "conversation": {"user": ["Why are prices missing for these games?"], "paraphrase": "Explain the different incomplete deal states."},
  "tool_policy": {"allowed": ["steam-agent deals query"], "required": [{"command": "steam-agent deals query", "arguments": ["--scope", "wishlist", "--account", "synthetic-primary", "--country", "US"]}], "prohibited": ["sync", "retry", "browser"]},
  "deterministic_oracle": {"recipe_or_contract": "M3 typed fallback states", "assertions": [
    {"path": "$.completeness", "operator": "equals", "expected": "partial"},
    {"path": "$.items[*].deal.primary_state", "operator": "ordered_equals", "expected": ["running", "failed", "unevaluated"]},
    {"path": "$.warnings[*].code", "operator": "contains", "expected": "PROVIDER_RATE_LIMITED"}
  ]},
  "fact_rubric": {"grading": "deterministic", "criteria": [
    {"id": "state-distinction", "weight": 10, "requirement": "Keep running, failed, and unevaluated distinct.", "hard_fail": true},
    {"id": "cache-only", "weight": 5, "requirement": "Do not imply that the query refreshed or retried data.", "hard_fail": true}
  ]},
  "judged_answer_rubric": {"grading": "model_or_human", "status": "opt_in", "criteria": [{"id": "diagnostic-clarity", "weight": 3, "requirement": "Explain each missing state in user-facing language."}]},
  "privacy_canaries": {"steam_id64": "EVAL_CANARY_STEAMID64_D07", "credential": "EVAL_CANARY_CREDENTIAL_D07", "local_path": "EVAL_CANARY_LOCAL_PATH_D07"}
}
